CTV3PreferredTermDesc,CTV3ID,CTV3Source
Deferred antibiotic therapy ,XaKYH,CTV3Map_Code_And_Term
Advance supply of steroid medication ,XaR16,CTV3Map_Code_And_Term
Issue of chronic obstructive pulmonary disease rescue pack ,XaW9D,CTV3Map_Code_And_Term
Chronic obstructive pulmonary disease monitoring ,XaIQT,CTV3Map_Code_And_Term
Chronic obstructive pulmonary disease annual review ,XaIet,CTV3Map_Code_And_Term
Number of COPD exacerbations in past year ,XaK8U,CTV3Map_Code_And_Term
Respiratory disease medication review,XaZpj,CTV3Map_Code_And_Term